{
  "id": "sharegpt-vicuna",
  "name": "ShareGPT conversations (LMSYS collection)",
  "builder": "LMSYS (collected from ShareGPT.com users)",
  "release_date": {
    "value": null,
    "status": "not_recorded"
  },
  "availability": {
    "value": "never_released",
    "checked": "2026-09-24",
    "source": "https://lmsys.org/blog/2023-03-30-vicuna/",
    "note": "Blog: 'There is no plan to release the dataset.'"
  },
  "content": {
    "value": "User-shared ChatGPT conversations from ShareGPT.com: ~70K for the first Vicuna (blog), ~125K for v1.3 (model card).",
    "source": "https://lmsys.org/blog/2023-03-30-vicuna/",
    "status": "recorded"
  },
  "primary_sources": [
    "https://lmsys.org/blog/2023-03-30-vicuna/",
    "https://huggingface.co/lmsys/vicuna-7b-v1.3"
  ],
  "record_history": [
    {
      "date": "2026-09-24",
      "change": "created from primary sources (dataset records ruling)",
      "by": "wilson-pruitt + claude"
    }
  ]
}
